School Name,Reading,Math,Writing,Address,lat,lng
HENRY STREET SCHOOL FOR INTERNATIONAL STUDIES,355,404,363,"220 Henry St, New York, NY 10002, USA",40.7134455,-73.9860332
UNIVERSITY NEIGHBORHOOD HIGH SCHOOL,383,423,366,"200 Monroe St, New York, NY 10002, USA",40.7121857,-73.9842031
EAST SIDE COMMUNITY SCHOOL,377,402,370,"420 E 12th St, New York, NY 10009, USA",40.7291086,-73.98252769999999
FORSYTH SATELLITE ACADEMY,414,401,359,"198 Forsyth St, New York, NY 10002, USA",40.7221984,-73.9907155
MARTA VALLE HIGH SCHOOL,390,433,384,"145 Stanton St 4th Floor, New York, NY 10002, USA",40.7201995,-73.9860534
LOWER EAST SIDE PREPARATORY HIGH SCHOOL,332,557,316,"145 Stanton St, New York, NY 10002, USA",40.720088,-73.9860332
"NEW EXPLORATIONS INTO SCIENCE, TECHNOLOGY AND MATH HIGH SCHOOL",522,574,525,None,None,None
CASCADES HIGH SCHOOL,417,418,411,"198 Forsyth St, New York, NY 10002, USA",40.7221767,-73.9906357
BARD HIGH SCHOOL EARLY COLLEGE,624,604,628,None,None,None
47 THE AMERICAN SIGN LANGUAGE AND ENGLISH SECONDARY SCHOOL,395,400,387,"223 E 23rd St, New York, NY 10010, USA",40.7387769,-73.9814014
FOOD AND FINANCE HIGH SCHOOL,409,393,392,"525 W 50th St, New York, NY 10019, USA",40.7653073,-73.9922821
ESSEX STREET ACADEMY,394,384,378,"350 Grand St, New York, NY 10002, USA",40.7174561,-73.9895561
HIGH SCHOOL OF HOSPITALITY MANAGEMENT,374,375,362,"525 W 50th St, New York, NY 10019, USA",40.7655356,-73.9931625
PACE HIGH SCHOOL,423,438,432,"4065 Norris Rd, Pace, FL 32571, USA",30.6142875,-87.154322
"URBAN ASSEMBLY SCHOOL OF DESIGN AND CONSTRUCTION, THE",404,449,416,"525 W 50th St, New York, NY 10019, USA",40.765536,-73.993163
"FACING HISTORY SCHOOL, THE",353,358,340,"525 W 50th St, New York, NY 10019, USA",40.7654304,-73.9926528
"URBAN ASSEMBLY ACADEMY OF GOVERNMENT AND LAW, THE",375,388,385,"350 Grand St, New York, NY 10002, USA",40.7173452,-73.9892929
LOWER MANHATTAN ARTS ACADEMY,403,392,405,"Manhattan, New York, NY, USA",40.7830603,-73.9712488
"JAMES BALDWIN SCHOOL, THE: A SCHOOL FOR EXPEDITIONARY LEARNING",408,390,390,"351 W 18th St, New York, NY 10011, USA",40.7432281,-74.002426
"URBAN ASSEMBLY SCHOOL OF BUSINESS FOR YOUNG WOMEN, THE",373,370,384,None,None,None
GRAMERCY ARTS HIGH SCHOOL,391,391,394,"40 Irving Pl, New York, NY 10003, USA",40.7354278,-73.9872741
NYC ISCHOOL,473,483,479,"131 6th Ave, New York, NY 10013, USA",40.7246823,-74.0050859
EMMA LAZARUS HIGH SCHOOL,319,512,357,"100 Hester St, New York, NY 10002, USA",40.71651869999999,-73.993222
HIGH SCHOOL FOR ENVIRONMENTAL STUDIES,465,493,461,"444 W 56th St, New York, NY 10019, USA",40.7679759,-73.9881796
INSTITUTE FOR COLLABORATIVE EDUCATION,492,465,467,"345 E 15th St, New York, NY 10003, USA",40.7326687,-73.9825816
PROFESSIONAL PERFORMING ARTS HIGH SCHOOL,509,490,523,"328 W 48th St, New York, NY 10036, USA",40.761226,-73.9886092
BARUCH COLLEGE CAMPUS HIGH SCHOOL,496,563,518,"55 E 25th St, New York, NY 10010, USA",40.7418485,-73.98590899999999
N.Y.C. LAB SCHOOL FOR COLLABORATIVE STUDIES,537,590,550,"333 W 17th St, New York, NY 10011, USA",40.7424259,-74.0026278
SCHOOL OF THE FUTURE HIGH SCHOOL,517,533,515,"127 E 22nd St, New York, NY 10010, USA",40.7390867,-73.9853658
N.Y.C. MUSEUM SCHOOL,468,492,459,"333 W 17th St, New York, NY 10011, USA",40.7424393,-74.0026597
ELEANOR ROOSEVELT HIGH SCHOOL,572,594,592,None,None,None
MILLENNIUM HIGH SCHOOL,528,553,533,"75 Broad St 13th floor, New York, NY 10004, USA",40.7046172,-74.01123249999999
LANDMARK HIGH SCHOOL,390,399,381,"351 W 18th St, New York, NY 10011, USA",40.7432281,-74.002426
HIGH SCHOOL FOR HEALTH PROFESSIONS AND HUMAN SERVICES,429,449,428,"345 E 15th St, New York, NY 10003, USA",40.7325522,-73.98267229999999
LEADERSHIP AND PUBLIC SERVICE HIGH SCHOOL,416,426,391,"90 Trinity Pl, New York, NY 10006, USA",40.70902419999999,-74.0123569
LEGACY SCHOOL FOR INTEGRATED STUDIES,356,357,349,None,None,None
MANHATTAN VILLAGE ACADEMY,441,473,458,"43 W 22nd St, New York, NY 10010, USA",40.74191870000001,-73.9922938
BAYARD RUSTIN EDUCATIONAL COMPLEX,378,365,368,"351 W 18th St, New York, NY 10011, USA",40.7437562,-74.0026651
VANGUARD HIGH SCHOOL,395,416,388,"7 NW 28th St, Ocala, FL 34475, USA",29.2160964,-82.1369909
MANHATTAN INTERNATIONAL HIGH SCHOOL,376,460,391,"317 E 67th St, New York, NY 10065, USA",40.7653683,-73.9596962
WASHINGTON IRVING HIGH SCHOOL,373,387,360,"40 Irving Pl, New York, NY 10003, USA",40.7354677,-73.987393
STUYVESANT HIGH SCHOOL,679,735,682,"345 Chambers St, New York, NY 10282, USA",40.7178149,-74.0138422
HIGH SCHOOL OF ECONOMICS AND FINANCE,443,489,442,"100 Trinity Pl, New York, NY 10006, USA",40.70925709999999,-74.0123392
UNITY CENTER FOR URBAN TECHNOLOGIES,370,349,351,"111 E 33rd St, New York, NY 10016, USA",40.74642130000001,-73.9811631
TALENT UNLIMITED HIGH SCHOOL,469,472,475,"300 E 68th St, New York, NY 10065, USA",40.76564,-73.959777
MURRY BERGTRAUM HIGH SCHOOL FOR BUSINESS CAREERS,407,440,393,"411 Pearl St, New York, NY 10038, USA",40.7113104,-74.0018829
JACQUELINE KENNEDY ONASSIS HIGH SCHOOL,414,425,400,"120 W 46th St, New York, NY 10036, USA",40.7577928,-73.9834084
REPERTORY COMPANY HIGH SCHOOL FOR THEATRE ARTS,429,404,420,"123 W 43rd St, New York, NY 10036, USA",40.7561203,-73.98445579999999
MANHATTAN BRIDGES HIGH SCHOOL,336,378,344,"525 W 50th St, New York, NY 10019, USA",40.7652446,-73.99273749999999
NEW DESIGN HIGH SCHOOL,391,395,382,"350 Grand St, New York, NY 10002, USA",40.7173452,-73.9892929
INDEPENDENCE HIGH SCHOOL,389,371,335,"617 N Jackson Ave, San Jose, CA 95133, USA",37.3684492,-121.8567359
HIGH SCHOOL FOR DUAL LANGUAGE AND ASIAN STUDIES,412,581,431,"350 Grand St, New York, NY 10002, USA",40.7173162,-73.989318
LIBERTY HIGH SCHOOL ACADEMY FOR NEWCOMERS,368,436,352,"250 W 18th St, New York, NY 10011, USA",40.74183050000001,-74.0002428
THE URBAN ASSEMBLY NEW YORK HARBOR SCHOOL,405,423,384,"Hay Rd, Brooklyn, NY 11231, USA",40.690387,-74.02052599999999
HIGH SCHOOL M560 s CITY AS SCHOOL,498,440,477,None,None,None
URBAN ACADEMY LABORATORY HIGH SCHOOL,527,508,512,"317 E 67th St, New York, NY 10065, USA",40.7653683,-73.9596962
SATELLITE ACADEMY HIGH SCHOOL,350,337,345,"120 W 30th St, New York, NY 10001, USA",40.7474341,-73.99056039999999
MANHATTAN COMPREHENSIVE NIGHT AND DAY HIGH SCHOOL,345,517,343,"240 2nd Ave, New York, NY 10003, USA",40.7326748,-73.9843188
RICHARD R. GREEN HIGH SCHOOL OF TEACHING,408,384,403,"7 Beaver St, New York, NY 10004, USA",40.7050989,-74.0128466
HARVEY MILK HIGH SCHOOL,458,416,429,"2 Astor Pl 3rd Floor, New York, NY 10003, USA",40.7298791,-73.99258309999999
THE HIGH SCHOOL OF FASHION INDUSTRIES,423,423,411,"225 W 24th St, New York, NY 10011, USA",40.7454593,-73.9965165
HUMANITIES PREPARATORY ACADEMY,426,403,426,"351 W 18th St, New York, NY 10011, USA",40.7431615,-74.0025033
CHELSEA CAREER AND TECHNICAL EDUCATION HIGH SCHOOL,399,418,390,"131 6th Ave, New York, NY 10013, USA",40.7246823,-74.0050859
NORMAN THOMAS HIGH SCHOOL,370,379,359,"111 E 33rd St, New York, NY 10016, USA",40.7463214,-73.9811295
HIGH SCHOOL OF GRAPHIC COMMUNICATION ARTS,395,382,376,"439 W 49th St, New York, NY 10019, USA",40.7639856,-73.9903637
ART AND DESIGN HIGH SCHOOL,444,441,430,"245 E 56th St, New York, NY 10022, USA",40.759047,-73.96648060000001
LIFE SCIENCES SECONDARY SCHOOL,409,424,403,None,None,None
MANHATTAN THEATRE LAB HIGH SCHOOL,406,379,408,"122 Amsterdam Ave, New York, NY 10023, USA",40.7747793,-73.98472000000001
"HIGH SCHOOL FOR ARTS, IMAGINATION AND INQUIRY",374,384,374,"122 Amsterdam Ave, New York, NY 10023, USA",40.7747498,-73.98514589999999
"URBAN ASSEMBLY SCHOOL FOR MEDIA STUDIES, THE",384,390,370,"122 Amsterdam Ave, New York, NY 10023, USA",40.7748463,-73.9856659
INNOVATION DIPLOMA PLUS,416,403,381,"145 W 84th St, New York, NY 10024, USA",40.78567290000001,-73.9740479
WADLEIGH SECONDARY SCHOOL FOR THE PERFORMING & VISUAL ARTS,371,368,370,None,None,None
LOUIS D. BRANDEIS HIGH SCHOOL,370,390,358,"13011 Kyle Seale Pkwy, San Antonio, TX 78249, USA",29.5654611,-98.6463289
BEACON HIGH SCHOOL,577,575,592,"522 W 44th St, New York, NY 10036, USA",40.7613016,-73.9960457
FIORELLO H. LAGUARDIA HIGH SCHOOL OF MUSIC & ART AND PERFORMING ARTS,566,564,577,"100 Amsterdam Ave, New York, NY 10023, USA",40.7741856,-73.9851211
"HIGH SCHOOL FOR LAW, ADVOCACY AND COMMUNITY JUSTICE",396,398,402,"122 Amsterdam Ave, New York, NY 10023, USA",40.7747793,-73.98472000000001
HIGH SCHOOL OF ARTS AND TECHNOLOGY,433,433,411,"122 Amsterdam Ave, New York, NY 10023, USA",40.7753818,-73.98606219999999
EDWARD A. REYNOLDS WEST SIDE HIGH SCHOOL,401,369,351,"140 W 102nd St, New York, NY 10025, USA",40.7971309,-73.96678320000001
MANHATTAN / HUNTER SCIENCE HIGH SCHOOL,473,506,467,"122 Amsterdam Ave, New York, NY 10023, USA",40.77456189999999,-73.985282
FREDERICK DOUGLASS ACADEMY II SECONDARY SCHOOL,356,379,361,"215 W 114th St, New York, NY 10026, USA",40.8025691,-73.95412139999999
COALITION SCHOOL FOR SOCIAL CHANGE,354,357,373,"2351 1st Ave., New York, NY 10035, USA",40.79921059999999,-73.9334681
MANHATTAN CENTER FOR SCIENCE AND MATHEMATICS,461,514,455,"260 Pleasant Ave, New York, NY 10029, USA",40.7943018,-73.9334062
PARK EAST HIGH SCHOOL,373,379,376,"230 E 105th St, New York, NY 10029, USA",40.7902049,-73.9441678
CENTRAL PARK EAST HIGH SCHOOL,405,421,395,"1573 Madison Ave, New York, NY 10029, USA",40.7936899,-73.9491583
YOUNG WOMEN,432,446,448,None,None,None
ACADEMY OF ENVIRONMENTAL SCIENCE SECONDARY HIGH SCHOOL,369,369,357,"410 E 100th St, New York, NY 10029, USA",40.7851693,-73.9422154
"HERITAGE SCHOOL, THE",358,351,345,"1680 Lexington Ave, New York, NY 10029, USA",40.791964,-73.946878
HARLEM RENAISSANCE HIGH SCHOOL,357,318,333,"22 E 128th St, New York, NY 10035, USA",40.807763,-73.93995699999999
MOTT HALL HIGH SCHOOL,413,399,398,"6 Edgecombe Ave 4th floor, New York, NY 10030, USA",40.817349,-73.94745
ACADEMY FOR SOCIAL ACTION: A COLLEGE BOARD SCHOOL,354,366,342,"3441 Steenwick Ave, Bronx, NY 10475, USA",40.8832047,-73.8306959
URBAN ASSEMBLY SCHOOL FOR THE PERFORMING ARTS,360,353,364,"509 W 129th St, New York, NY 10027, USA",40.815709,-73.9556642
CHOIR ACADEMY OF HARLEM,354,360,385,"2005 Madison Ave, New York, NY 10035, USA",40.80706259999999,-73.9388293
FREDERICK DOUGLASS ACADEMY,458,474,442,"2581 Adam Clayton Powell Jr Blvd, New York, NY 10039, USA",40.8242911,-73.9366898
THURGOOD MARSHALL ACADEMY FOR LEARNING AND SOCIAL CHANGE,396,402,404,"200-214 W 135th St, New York, NY 10030, USA",40.8152484,-73.9443203
BREAD & ROSES INTEGRATED ARTS HIGH SCHOOL,369,361,355,None,None,None
"HIGH SCHOOL FOR MATHEMATICS, SCIENCE AND ENGINEERING AT CITY COLLEGE",605,654,588,"240 Convent Ave, New York, NY 10031, USA",40.8214739,-73.94903889999999
CITY COLLEGE ACADEMY OF THE ARTS,408,446,416,"4600 Broadway, New York, NY 10040, USA",40.8608456,-73.93014939999999
COMMUNITY HEALTH ACADEMY OF THE HEIGHTS,362,376,367,"504 W 158th St, New York, NY 10032, USA",40.8336116,-73.9421984
WASHINGTON HEIGHTS EXPEDITIONARY LEARNING SCHOOL,380,395,399,"511 W 182nd St, New York, NY 10033, USA",40.8491088,-73.93109919999999
GEORGE WASHINGTON YABC,394,357,346,None,None,None
HIGH SCHOOL FOR INTERNATIONAL BUSINESS AND FINANCE,365,384,378,None,None,None
HIGH SCHOOL FOR MEDIA AND COMMUNICATIONS,369,380,349,"549 Audubon Ave, New York, NY 10040, USA",40.8561208,-73.9263326
HIGH SCHOOL FOR LAW AND PUBLIC SERVICE,363,378,361,"549 Audubon Ave, New York, NY 10040, USA",40.8558937,-73.9260333
HIGH SCHOOL FOR HEALTH CAREERS AND SCIENCES,400,422,402,"549 Audubon Ave, New York, NY 10040, USA",40.8558937,-73.9260333
A. PHILIP RANDOLPH CAMPUS HIGH SCHOOL,430,456,423,"443 W 135th St, New York, NY 10031, USA",40.8183585,-73.94996960000002
GREGORIO LUPERON HIGH SCHOOL FOR SCIENCE AND MATHEMATICS,339,349,326,"501 W 165th St, New York, NY 10032, USA",40.8382264,-73.93853560000001
SOUTH BRONX PREPARATORY: A COLLEGE BOARD SCHOOL,364,378,348,"Bronx, NY, USA",40.8447819,-73.8648268
CROTONA ACADEMY HIGH SCHOOL,379,364,382,"1211 Southern Blvd, Bronx, NY 10459, USA",40.8293132,-73.89209369999999
INTERNATIONAL COMMUNITY HIGH SCHOOL,310,324,311,"345 Brook Ave, Bronx, NY 10454, USA",40.8099176,-73.9183515
COMMUNITY SCHOOL FOR SOCIAL JUSTICE,361,359,357,"350 Gerard Ave, Bronx, NY 10451, USA",40.8156741,-73.9301357
MOTT HAVEN VILLAGE PREPARATORY HIGH SCHOOL,351,375,371,"701 St Ann's Ave, Bronx, NY 10455, USA",40.81827819999999,-73.9117284
UNIVERSITY HEIGHTS SECONDARY SCHOOL,403,394,404,"701 St Ann's Ave, Bronx, NY 10455, USA",40.8182061,-73.9113093
HOSTOSsLINCOLN ACADEMY OF SCIENCE,420,426,411,"600 St Ann's Ave, Bronx, NY 10455, USA",40.814537,-73.9124247
FOREIGN LANGUAGE ACADEMY OF GLOBAL STUDIES,399,396,391,"470 Jackson Ave #116, Bronx, NY 10455, USA",40.810911,-73.90928389999999
BRONX LEADERSHIP ACADEMY II HIGH SCHOOL,362,378,363,"730 Concourse Village W, Bronx, NY 10451, USA",40.8223498,-73.9227204
NEW EXPLORERS HIGH SCHOOL,367,356,361,"730 Concourse Village W, Bronx, NY 10451, USA",40.8225734,-73.9235453
URBAN ASSEMBLY SCHOOL FOR CAREERS IN SPORTS,387,411,383,"730 Concourse Village W, Bronx, NY 10451, USA",40.8225735,-73.9235453
BRONX ACADEMY OF LETTERS,413,381,407,"339 Morris Ave, Bronx, NY 10451, USA",40.81366,-73.92599899999999
ALFRED E. SMITH CAREER AND TECHNICAL EDUCATION HIGH SCHOOL,394,400,364,"333 E 151st St, Bronx, NY 10451, USA",40.8189146,-73.92001309999999
SAMUEL GOMPERS CAREER AND TECHNICAL EDUCATION HIGH SCHOOL,398,416,370,None,None,None
HEALTH OPPORTUNITIES HIGH SCHOOL,363,368,364,"350 Gerard Ave, Bronx, NY 10451, USA",40.8156611,-73.93034159999999
WOMEN,407,386,378,None,None,None
RENAISSANCE HIGH SCHOOL FOR MUSICAL THEATER & TECHNOLOGY,384,385,389,None,None,None
GATEWAY SCHOOL FOR ENVIRONMENTAL RESEARCH AND TECHNOLOGY,416,390,394,None,None,None
PABLO NERUDA ACADEMY FOR ARCHITECTURE AND WORLD STUDIES,337,361,340,None,None,None
MILLENNIUM ART ACADEMY,387,402,375,"1980 Lafayette Ave, Bronx, NY 10473, USA",40.8211726,-73.8567899
HOLCOMBE L. RUCKER SCHOOL OF COMMUNITY RESEARCH,363,371,350,None,None,None
BRONX COMMUNITY HIGH SCHOOL,367,369,376,"Bronx, NY, USA",40.8447819,-73.8648268
HERBERT H. LEHMAN HIGH SCHOOL,412,436,393,"3000 E Tremont Ave, Bronx, NY 10461, USA",40.8400063,-73.8392547
HERBERT H. LEHMAN YABC,402,373,413,None,None,None
BRONX GUILD,369,371,365,"Bronx, NY, USA",40.8447819,-73.8648268
"FELISA RINCON DE GAUTIER INSTITUTE FOR LAW AND PUBLIC POLICY, THE",373,370,356,"1440 Story Ave, Bronx, NY 10473, USA",40.820831,-73.8806876
BANANA KELLY HIGH SCHOOL,373,381,377,"965 Longwood Ave, Bronx, NY 10459, USA",40.8176439,-73.8980239
SCHOOL FOR COMMUNITY RESEARCH AND LEARNING,366,400,368,None,None,None
HIGH SCHOOL X560 s BRONX ACADEMY HIGH SCHOOL,404,368,399,"Bronx, NY, USA",40.8447819,-73.8648268
JANE ADDAMS HIGH SCHOOL FOR ACADEMIC CAREERS,377,359,376,"900 Tinton Ave, Bronx, NY 10456, USA",40.8217805,-73.90302919999999
BRONX EXPEDITIONARY LEARNING HIGH SCHOOL,324,376,349,"Bronx, NY, USA",40.8447819,-73.8648268
EAGLE ACADEMY FOR YOUNG MEN,373,387,374,"4143 Third Ave, Bronx, NY 10457, USA",40.845264,-73.897176
"URBAN ASSEMBLY ACADEMY FOR HISTORY AND CITIZENSHIP FOR YOUNG MEN, THE",372,355,357,None,None,None
"URBAN ASSEMBLY SCHOOL FOR APPLIED MATH AND SCIENCE, THE",411,464,415,"1595 Bathgate Ave, Bronx, NY 10457, USA",40.8394571,-73.9018947
EXIMIUS COLLEGE PREPARATORY ACADEMY: A COLLEGE BOARD SCHOOL,393,394,382,"1363 Fulton Ave, Bronx, NY 10456, USA",40.8339721,-73.9027472
MOTT HALL BRONX HIGH SCHOOL,369,367,356,"1595 Bathgate Ave, Bronx, NY 10457, USA",40.8390693,-73.9020614
BRONX CENTER FOR SCIENCE AND MATHEMATICS,459,480,457,"1363 Fulton Ave, Bronx, NY 10456, USA",40.8339407,-73.9025746
VALIDUS PREPARATORY ACADEMY: AN EXPEDITIONARY LEARNING SCHOOL,356,363,356,"1595 Bathgate Ave, Bronx, NY 10457, USA",40.8397979,-73.90162649999999
LEADERSHIP INSTITUTE,361,353,367,None,None,None
MORRIS ACADEMY FOR COLLABORATIVE STUDIES,386,386,376,"1110 Boston Rd, Bronx, NY 10456, USA",40.8273033,-73.9045097
DREAMYARD PREPARATORY SCHOOL,382,365,391,"240 E 172nd St, Bronx, NY 10457, USA",40.8396259,-73.9113888
ACADEMY FOR LANGUAGE AND TECHNOLOGY,315,339,297,"1700 Macombs Rd, Bronx, NY 10453, USA",40.8493122,-73.91565299999999
BRONX INTERNATIONAL HIGH SCHOOL,314,312,339,"1110 Boston Rd, Bronx, NY 10456, USA",40.8269361,-73.9035648
SCHOOL FOR EXCELLENCE,363,360,351,None,None,None
BRONX HIGH SCHOOL OF BUSINESS,356,376,351,"240 E 172nd St, Bronx, NY 10457, USA",40.83965449999999,-73.911386
BRONX HIGH SCHOOL FOR MEDICAL SCIENCE,400,419,402,"240 E 172nd St, Bronx, NY 10457, USA",40.8398672,-73.9111588
JONATHAN LEVIN HIGH SCHOOL FOR MEDIA AND COMMUNICATIONS,379,364,379,"240 E 172nd St, Bronx, NY 10457, USA",40.8398672,-73.9111588
"BRONX SCHOOL FOR LAW, GOVERNMENT AND JUSTICE",404,418,402,"244 E 163rd St, Bronx, NY 10451, USA",40.8274689,-73.9188614
FREDERICK DOUGLASS ACADEMY III SECONDARY SCHOOL,368,384,369,"3630 Third Ave, Bronx, NY 10456, USA",40.83348549999999,-73.9043324
BRONX LEADERSHIP ACADEMY HIGH SCHOOL,384,394,388,"1710 Webster Ave, Bronx, NY 10457, USA",40.8434287,-73.90310939999999
HIGH SCHOOL FOR VIOLIN AND DANCE,353,315,371,"1110 Boston Rd, Bronx, NY 10456, USA",40.8273033,-73.9045097
RIVERDALE / KINGSBRIDGE ACADEMY (MIDDLE SCHOOL / HIGH SCHOOL 141),438,455,440,"660 W 237th St, Bronx, NY 10463, USA",40.8876785,-73.91337829999999
BRONX ENGINEERING AND TECHNOLOGY ACADEMY,373,412,365,"99 Terrace View Ave, New York, NY 10463, USA",40.8770191,-73.91253309999999
THEATRE ARTS PRODUCTION COMPANY SCHOOL,405,391,394,"2225 Webster Ave, Bronx, NY 10457, USA",40.8545833,-73.89719529999999
"THE MARIE CURIE SCHOOL FOR MEDICINE, NURSING, AND HEALTH PROFESSIONS",382,393,382,"120 W 231st St, Bronx, NY 10463, USA",40.8756546,-73.90162769999999
WEST BRONX ACADEMY FOR THE FUTURE,382,406,370,"500 E Fordham Rd, Bronx, NY 10458, USA",40.8599092,-73.88834109999999
KINGSBRIDGE INTERNATIONAL HIGH SCHOOL,304,356,302,"2780 Reservoir Ave, Bronx, NY 10468, USA",40.8701132,-73.8964878
BRONX SCHOOL OF LAW AND FINANCE,402,395,385,"99 Terrace View Ave #804, Bronx, NY 10463, USA",40.87782670000001,-73.9137832
INTERNATIONAL SCHOOL FOR LIBERAL ARTS,300,333,301,"2780 Reservoir Ave, Bronx, NY 10468, USA",40.8704419,-73.8969425
INsTECH ACADEMY (M.S. / HIGH SCHOOL 368),390,408,383,"Mississippi, USA",32.3546679,-89.3985283
KNOWLEDGE AND POWER PREPARATORY ACADEMY INTERNATIONAL HIGH SCHOOL (KAPPA),392,401,387,"500 E Fordham Rd, Bronx, NY 10458, USA",40.859837,-73.8882078
ENGLISH LANGUAGE LEARNERS AND INTERNATIONAL SUPPORT PREPARATORY ACADEMY (ELLIS),343,356,330,"99 Terrace View Ave, New York, NY 10463, USA",40.8770507,-73.912562
HIGH SCHOOL FOR TEACHING AND THE PROFESSIONS,370,371,365,"2780 Reservoir Ave, Bronx, NY 10468, USA",40.8707784,-73.897505
BELMONT PREPARATORY HIGH SCHOOL,404,418,400,"500 E Fordham Rd, Bronx, NY 10458, USA",40.8596644,-73.88801629999999
FORDHAM HIGH SCHOOL FOR THE ARTS,355,350,372,"500 E Fordham Rd, Bronx, NY 10458, USA",40.859836,-73.8882002
FORDHAM LEADERSHIP ACADEMY FOR BUSINESS AND TECHNOLOGY,367,385,367,"500 E Fordham Rd, Bronx, NY 10458, USA",40.8598708,-73.8882672
BRONX HIGH SCHOOL FOR LAW AND COMMUNITY SERVICE,366,364,352,"500 E Fordham Rd, Bronx, NY 10458, USA",40.8596908,-73.888067
DEWITT CLINTON HIGH SCHOOL,419,426,410,"100 W Mosholu Pkwy S, Bronx, NY 10468, USA",40.8812165,-73.8875851
"CELIA CRUZ BRONX HIGH SCHOOL OF MUSIC, THE",423,420,427,"2780 Reservoir Ave, Bronx, NY 10468, USA",40.87085070000001,-73.8974495
BRONX HIGH SCHOOL OF SCIENCE,632,688,649,"75 W 205th St, Bronx, NY 10468, USA",40.8783912,-73.8911437
JOHN F. KENNEDY HIGH SCHOOL,351,362,339,None,None,None
MARBLE HILL HIGH SCHOOL FOR INTERNATIONAL STUDIES,414,435,414,"99 Terrace View Ave, Bronx, NY 10463, USA",40.8776626,-73.913269
BRONX THEATRE HIGH SCHOOL,348,362,354,"99 Terrace View Ave, Bronx, NY 10463, USA",40.87769309999999,-73.91333
DISCOVERY HIGH SCHOOL,372,379,364,"1335 Old Norcross Rd, Lawrenceville, GA 30046, USA",33.9553149,-84.034843
GRACE DODGE CAREER AND TECHNICAL EDUCATION HIGH SCHOOL,362,382,356,None,None,None
GRACE DODGE YABC,350,356,317,None,None,None
HIGH SCHOOL OF AMERICAN STUDIES AT LEHMAN COLLEGE,636,648,636,"2925 Goulden Ave, Bronx, NY 10468, USA",40.8747654,-73.895071
BRONX HEALTH SCIENCES HIGH SCHOOL,370,381,382,"750 Baychester Ave, Bronx, NY 10475, USA",40.874013,-73.8330371
BRONX HIGH SCHOOL FOR WRITING AND COMMUNICATION ARTS,400,357,390,"800 E Gun Hill Rd, Bronx, NY 10467, USA",40.8753426,-73.8615889
BRONX LAB SCHOOL,377,391,367,"800 E Gun Hill Rd, Bronx, NY 10467, USA",40.8748792,-73.8619068
ACADEMY FOR SCHOLARSHIP AND ENTREPRENEURSHIP: A COLLEGE BOARD SCHOOL,386,394,361,"921 E 228th St, Bronx, NY 10466, USA",40.8880709,-73.85270059999999
HIGH SCHOOL OF COMPUTERS AND TECHNOLOGY,381,376,354,"800 E Gun Hill Rd, Bronx, NY 10467, USA",40.8754469,-73.86117689999999
COLLEGIATE INSTITUTE FOR MATH AND SCIENCE,444,471,433,"925 Astor Ave, Bronx, NY 10469, USA",40.8603747,-73.8603398
BRONX ACADEMY OF HEALTH CAREERS,387,365,383,"800 E Gun Hill Rd, Bronx, NY 10467, USA",40.8750988,-73.86166229999999
ASTOR COLLEGIATE ACADEMY,387,391,391,"925 Astor Ave, Bronx, NY 10469, USA",40.8599147,-73.86007860000001
CHRISTOPHER COLUMBUS HIGH SCHOOL,367,361,353,"3000 SW 87th Ave, Miami, FL 33165, USA",25.741643,-80.338617
BRONX HIGH SCHOOL FOR THE VISUAL ARTS,419,433,416,"2040 Antin Pl, Bronx, NY 10462, USA",40.8517412,-73.8644982
HARRY S TRUMAN HIGH SCHOOL,386,397,368,"750 Baychester Ave, Bronx, NY 10475, USA",40.8741473,-73.8328179
NEW WORLD HIGH SCHOOL,332,381,335,"921 E 228th St, Bronx, NY 10466, USA",40.8880709,-73.85270059999999
THE BRONXWOOD PREPARATORY ACADEMY,377,372,363,"921 E 228th St, Bronx, NY 10466, USA",40.8880709,-73.85270059999999
GLOBAL ENTERPRISE HIGH SCHOOL,372,382,375,None,None,None
PELHAM PREPARATORY ACADEMY,431,438,419,"925 Astor Ave, Bronx, NY 10469, USA",40.8603116,-73.8602433
HIGH SCHOOL FOR CONTEMPORARY ARTS,383,378,365,"800 E Gun Hill Rd, Bronx, NY 10467, USA",40.8751267,-73.8617246
BRONX AEROSPACE HIGH SCHOOL,388,393,382,"800 E Gun Hill Rd, Bronx, NY 10467, USA",40.8755654,-73.8614327
NEW DAY ACADEMY,348,344,354,"800 Home St, Bronx, NY 10456, USA",40.8271204,-73.9008891
"METROPOLITAN HIGH SCHOOL, THE",347,367,341,"1180 Rev James A Polite Ave, Bronx, NY 10459, USA",40.82773299999999,-73.897018
EXPLORATIONS ACADEMY,381,381,360,"1701 Ellis St STE 215, Bellingham, WA 98225, USA",48.7526416,-122.4723572
PERFORMANCE CONSERVATORY HIGH SCHOOL,361,353,360,None,None,None
BRONX LATIN,408,432,411,"800 Home St, Bronx, NY 10456, USA",40.8277047,-73.9006169
EAST BRONX ACADEMY FOR THE FUTURE,366,378,358,"1716 Southern Blvd, Bronx, NY 10460, USA",40.8368092,-73.8876647
PEACE AND DIVERSITY ACADEMY,390,401,364,"1180 Rev James A Polite Ave, Bronx, NY 10459, USA",40.82771899999999,-73.8970008
PAN AMERICAN INTERNATIONAL HIGH SCHOOL AT MONROE,321,351,298,"1300 Boynton Ave, Bronx, NY 10472, USA",40.83246570000001,-73.87883769999999
ARTURO A. SCHOMBURG SATELLITE ACADEMY BRONX,380,372,349,"1010 Rev James A Polite Ave, Bronx, NY 10459, USA",40.8232858,-73.89873419999999
BRONX REGIONAL HIGH SCHOOL,398,385,398,"1010 Rev James A Polite Ave, Bronx, NY 10459, USA",40.8233177,-73.8987455
HIGH SCHOOL OF WORLD CULTURES,304,323,312,"1300 Boynton Ave Floor 4, Bronx, NY 10472, USA",40.8325896,-73.8784878
FANNIE LOU HAMER FREEDOM HIGH SCHOOL,342,346,341,"1021 Jennings St, Bronx, NY 10460, USA",40.8311242,-73.88568839999999
WINGS ACADEMY,378,374,362,"1122 E 180th St, Bronx, NY 10460, USA",40.8416155,-73.87521319999999
MONROE ACADEMY FOR BUSINESS/LAW,375,387,376,"1300 Boynton Ave, Bronx, NY 10472, USA",40.83204509999999,-73.8783844
MONROE ACADEMY FOR VISUAL ARTS & DESIGN,332,357,349,None,None,None
DR. SUSAN S. MCKINNEY SECONDARY SCHOOL OF THE ARTS,352,349,373,"101 Park Ave, Brooklyn, NY 11205, USA",40.6969046,-73.9759851
ACADEMY OF BUSINESS AND COMMUNITY DEVELOPMENT,439,374,418,None,None,None
URBAN ASSEMBLY HIGH SCHOOL OF MUSIC AND ART,360,364,356,"90 Broad St #2101, New York, NY 10004, USA",40.7037913,-74.0117965
"BROOKLYN COMMUNITY HIGH SCHOOL OF COMMUNICATION, ARTS AND MEDIA",375,355,384,"Brooklyn, NY, USA",40.6781784,-73.9441579
"SCIENCE SKILLS CENTER HIGH SCHOOL FOR SCIENCE, TECHNOLOGY AND THE CREATIVE ARTS",399,417,395,"49 Flatbush Ave Ext, Brooklyn, NY 11201, USA",40.6973489,-73.98474759999999
BROOKLYN TECHNICAL HIGH SCHOOL,587,659,587,"29 Fort Greene Pl, Brooklyn, NY 11217, USA",40.6890878,-73.9767351
BROOKLYN INTERNATIONAL HIGH SCHOOL,305,364,312,"49 Flatbush Ave Ext, Brooklyn, NY 11201, USA",40.6973902,-73.9848191
THE URBAN ASSEMBLY SCHOOL FOR LAW AND JUSTICE,400,417,389,"283 Adams St, Brooklyn, NY 11201, USA",40.6944935,-73.9885235
ACORN COMMUNITY HIGH SCHOOL,384,364,368,"561 Grand Ave, Brooklyn, NY 11238, USA",40.6785204,-73.9617427
FREEDOM ACADEMY HIGH SCHOOL,400,390,403,"116 Nassau St, Brooklyn, NY 11201, USA",40.6984181,-73.9865245
BROOKLYN ACADEMY HIGH SCHOOL,435,383,379,"832 Marcy Ave, Brooklyn, NY 11216, USA",40.6844957,-73.9479614
BEDFORD STUYVESANT PREPARATORY HIGH SCHOOL,398,391,394,"832 Marcy Ave, Brooklyn, NY 11216, USA",40.6846109,-73.94788969999999
BEDFORD ACADEMY HIGH SCHOOL,438,443,431,"1119 Bedford Ave, Brooklyn, NY 11216, USA",40.6855293,-73.9540295
GEORGE WESTINGHOUSE CAREER AND TECHNICAL EDUCATION HIGH SCHOOL,406,391,392,"105 Tech Pl, Brooklyn, NY 11201, USA",40.6958065,-73.98559879999999
BENJAMIN BANNEKER ACADEMY,471,472,448,"71-77 Clinton Ave, Brooklyn, NY 11205, USA",40.69547410000001,-73.9690605
"CITY POLYTECHNIC HIGH SCHOOL OF ENGINEERING, ARCHITECTURE, AND TECHNOLOGY",441,499,413,"105 Tech Pl, Brooklyn, NY 11201, USA",40.69586330000001,-73.9856825
JUAN MOREL CAMPOS SECONDARY SCHOOL,365,361,359,"215 Heyward St, Brooklyn, NY 11206, USA",40.70382,-73.9535677
ACADEMY FOR YOUNG WRITERS,387,357,381,"1065 Elton St, Brooklyn, NY 11239, USA",40.6573832,-73.8742165
